Dan	7	1	Baltazárnak , Babilon királyának elő esztendejében látá Dániel álmát , ő fejének látását és ő álmait ő hajlékában megírván rövid beszédbe foglalá , és mindeniket egyembe szorítván mondá :
Dan	7	2	látom vala én látásomban éjjel , és íme mennynek négy szelei vívnak vala  nagy tengerben .
Dan	7	3	és négy igen nagy vadak felmennek vala a tengerből , különbözetesek önnönközöttük .
Dan	7	4	az elő monnal leena , és vall vala szárnyakat monnal keselyűét , és nézem vala , míglen elszakadnának ő szárnyai , és elvettetett földről , és ő lábaira álla monnal ember , ő szíve megadattaték őneki .
Dan	7	5	és íme más vad , egyenlő medvével , felfele álla , és ő szájában háromszor fogak valának , és ő fogaiban három fejedelmek , és így mondanak vala neki : kelj fel , egyél sok húsokat !
Dan	7	6	ezek után nézek vala , és íme , más , monnal párduc , és négy szárnyakat vall vala őrajta monnal madaraknak szárnyait , és négy fejek valának a vadon , és hatalom adattaték őneki .
Dan	7	7	ez után nézek vala éjnek látásában , és íme ,   negyed vad , szörnyű és csodálatos és igen erős , négy vasfogakat vall vala , evén és megtörvén , és a maradékokat lábaival nyomodja vala meg , az egyéb vadakkal kedig , melyeket eleztébb láttam vala , nem egyenlő vala , és tíz szarvakat vall vala .
Dan	7	8	nézem vala a szarvakat , és íme , ő közepükből támada más , kicsinyed szarv ,   és ő orcája elől az eleztébbeli szarvakban hármak elesének , és íme szemek valának  e  szarvban  monnal embernek szemei és nagyokat szóló száj .
Dan	7	9	nézem vala , míglen székek vettetének , és napoknak véne leüle , ő ruhája fehér monnal hó , és ő fejének fürtje monnal tiszta gyapjú , ő széke tűznek lángja , ő kereke meggerjesztett tűz .
Dan	7	10	tüzes folyó és gyors származik vala ő  orcájából , ezerszer ezrek szolgálnak vala neki , és tízszer ezrek , százszor ezrek jelen valának őneki , ítéletre üle , és könyvek megnyittatának .
Dan	7	11	nézem vala a nagy beszédnek szaváért , kiket a szarv beszél vala , és látám , mert megölettetett volna a vad , és elveszett volna ő teste , és adattatott volna tűznek megégetésére ,
Dan	7	12	és az egyéb vadaknak elvettetett volna hatalma , és  életnek idői szerzettetének volna őnekik ideiglen és ideiglen .
Dan	7	13	nézem vala azért éjnek látásában , és íme , mennynek ködjeivel jő vala monnal embernek fia , juta a napoknak vettéiglen , azaz  Atyaistennek egyenlőségére istensége szerint , és ő személye elébe vivék őtet .
Dan	7	14	és ada neki hatalmat és tisztességet  és országot , és minden népek , nyelvek , és nemek szolgálnak őneki . ő hatalma örök hatalom , ki el nem vettethetik , és ő országa , ki meg nem törettetik .
Dan	7	15	megijede én szelletem , én , Dániel , megijedék ezekben , és én főmnek látásai megháborítának engemet .
Dan	7	16	vépém egyhez az állók közül , és igazságot keresék vala őtőle mindazokról , ki megmondá énnekem a beszédeknek magyarázatát , és megtaníta engemet :
Dan	7	17	a négy nagy vadak négy országok , kik felkelnek földből .
Dan	7	18	veszik kedig a felséges Isten szentjeinek országát , és megtartják az országot mindörökkön örökké .
Dan	7	19	ezután akarék szerelmest tudakoznom a negyed vadról , ki igen különbözetes vala mindenektől , mindeniktől igen szörnyű vala , ő fogai és körmei vasak , eszik vala , és tör vala , és a maradékokat lábaival nyomodja vala meg ,
Dan	7	20	és ő tíz szarvaiból , melyeket vall vala ő fején , és a másról , mely támadott vala azelőtt , hogy három szarvai leestek vala a szarvról , mely szemeket vall vala , és a nagy szóló száj , és nagyobb vala egyebeitől .
Dan	7	21	nézem vala , és íme , a szarv hadat teszen vala a szentek ellen , és hatalmazik vala őrajtuk ,
Dan	7	22	míglen eljő napoknak véne , és ítéletet ad a felséges szentjeinek , és az idő eljöve , és az országot megvevék a szentek .
Dan	7	23	és így monda : a negyed vad negyed ország leszen földön , ki nagyobb leszen  minden országoknál , és megmarja mind a földet , és megnyomodja , és mindenestül eltöri őtet .
Dan	7	24	valóbizony az országnak tíz szarvai tíz királyok lesznek , és más támad őutánuk , és ő hatalmasabb leszen az előbbelieknél , és a három királyokat megalázza .
Dan	7	25	és beszédeket szól a felséges ellen , és a felségesnek   szentjeit megtöri , és alítja , hogy időket és törvényeket megváltoztathasson , és adattatnak ő kezébe ideiglen és időkiglen és félidőiglen .
Dan	7	26	és ítéletre ül , hogy elvettessék ő hatalma , és megtörettessék , és elvesszen mindvégiglen .
Dan	7	27	az ország kedig és hatalom és az országnak nagysága , ki vagyon minden mennynek alatta , a felséges szent népének adattassék , kinek országa örök ország , és minden királyok szolgálnak a felségesnek , és engednek őneki .
Dan	7	28	ez eddiglen igének vége . én , Dániel , én gondolataimban igen megháborodom vala , és én orcám megváltoztatott énbennem , az igét kedig én szívemben megtartám .
Dan	8	1	Baltazár király országlatának harmad esztendejében látat jelenék énnekem . én , Dániel , az után , melyet először láttam vala ,
Dan	8	2	láték én látatomban , mikor volnék Susának várában , ki vagyon Elámnak vidékében , látám kedig a látatban Ulájnak kapuján .
Dan	8	3	és felemelém én szemeimet , és látám , és íme , egy kos áll vala az ingovány előtt , vallván tíz magas szarvakat , és egyik magasabb vala a másnál és növekedő . ezután
Dan	8	4	látám a kost szarvaival tékozlót napkelet ellen és napnyugat ellen , észfek ellen és dél ellen , és minden vadak nem állhatának őellene , sem szabadulhatának meg ő kezéből , és tőn ő akarata szerint , és felmagasztaték .
Dan	8	5	és én értem vala , mert íme , kecskéknek bakja jő vala napnyugatról minden földnek személyén , és földet nem illet vala , valóbizony a bak vall vala igen fényes szarvat ő szarvai között .
Dan	8	6	és jöve a szarvas kosiglan , kit láttam vala állatta a kapu előtt , és őhozzá futamék ő erősségének hirtelenkedetében .
Dan	8	7	és mikor közelített volna a koshoz , közel fenelkedék őrája ,  és megveré a  kost , és megtöré ő két szarvait , és a kos nem állhata őellene , és mikor eresztette volna őtet a földre , megnyomodá őtet , és senki meg nem szabadíthatá a kost ő kezéből .
Dan	8	8	a kecskéknek kedig bakja lőn igen naggyá , és mikor növekedett volna , megszegék a nagy szarv , és négy szarvak támadának azalatt mennynek négy szeleivel .
Dan	8	9	annak kedig egyikből kijöve egy kosszarv , és lőn igen naggyá dél ellen és napkelet ellen és az erősség ellen .
Dan	8	10	és felmagasztaték mennynek erősségéiglen , és leveté az erősségből és a csillagokból , és megnyomodá azokat .
Dan	8	11	és felmagasztaték az erősségnek fejedelméiglen , és elvevé őtőle az állhatatos áldozatot , és leveté ő szenteletének helyét .
Dan	8	12	erő kedig adattaték őneki az állhatatos áldozat ellen bűnökért , és igazság földre terjesztetik le , és teszi , és boldoglatik .  
Dan	8	13	és hallék egyet a szentekből beszélőt , és mondá egy szent a másiknak ,  nem tudom kinek szólónak : míglen nyomottatik meg a látás és az állhatatos áldozat és a pusztulatnak bűne , mely lett , és a sanctuarium    és az erősség ?
Dan	8	14	és mondá énnekem : estveléiglen és holvaliglan kétezer-háromszáz napiglan , és megtisztíttatik a sanctuarium .
Dan	8	15	lőn kedig , midőn én , Dániel , látnám e  látatot , és keresném értelmét , íme állapék én személyem előtt monnal férfiúnak személye .
Dan	8	16	és hallám férfiúnak szavát Uláj között , és üvölte , és mondá : Gábriel , értessed meg e  látatot !
Dan	8	17	és jöve , és állapék Uláj mellett , hol én állok vala , és mikor eljött volna , ijedvén leesém én orcámra .
Dan	8	19	és mondá énnekem : én megmutatom teneked , melyek jövendők legyenek az átkozatnak utoljában , mert idő vallja ő végét .
Dan	8	20	és a kos , kit láttál szarvakat vallani , médusoknak és perzsiaiaknak királya .
Dan	8	21	valóbizony a kecskéknek bakja görögöknek királya , és a nagy szarv , mely vala ő szemei előtt , ő elő király .
Dan	8	22	hogy kedig a megszegvén támadtanak négyek őérte , négy királyok támadnak ő nemzetéből , de nem ő erősségében .
Dan	8	23	és ő országuk után , mikor növekednének a hamisságok , támad szemérmetlen orcájú király és szerzéseket megértő ,
Dan	8	24	és megerősíttetik ő erőssége , de nem ő erejében , és mindeneket megpusztít inkább , hogy nem hitethetnék , és boldoglatik , és teszen . és megöl erőseket és szenteknek népét
Dan	8	25	ő akarata szerint , és álság  viseltetik ő kezében , és ő szíve felmagasztatik , és minden vágynak bőségében  sokakat öl meg , és fejedelmeknek fejedelme ellen támad , és kéz nélkül törettetik meg .
Dan	8	26	és a látat , mely este és holval mondaték , igaz , azért jegyezzed meg e  látatot , mert sok napok után leszen ez .
Dan	8	27	és én , Dániel , megleletezém , és megbetegülék sok napokban , és mikor felkeltem volna , teszem vala királynak művelkedeteit , és csodálkodom vala e látaton , és nem vala , ki megmagyarázza .
Dan	9	1	Achasvéros Dárius királynak elő esztendejében médusoknak nemzetéből , ki parancsola káldeusoknak országán ,
Dan	9	2	ő országának elő esztendejében én , Dániel , megértém az esztendők számának könyvében , kiről lett Úrnak beszéde Jeremiás prófétához , hogy beteljesednének Jeruzsálem pusztulatának hetven esztendői .
Dan	9	3	és vetém én orcámat én Uram Istenemhez , kérnem és unszolnom böjtökben , zsákban és hamuban .
Dan	9	4	és imádám én Uramat Istenemet , és vallék , és mondék : unszollak , nagy Úr Isten , és félelmes és csodálatos , te őrizvén a fogadást és irgalmasságot   tégedet szeretőkben , és te parancsolataidat őrizőkben .
Dan	9	5	bűnhettünk , hamisan tettünk , kegyetlenül művelkedtünk , és elmentünk , és elhajlottunk te parancsolataidtól és ítéleteidtől .
Dan	9	6	nem engedtünk te szolgáidnak , prófétáknak , kik beszéltenek te nevedbe mi királyainknak , mi fejedelmeinknek és mi atyáinknak és földnek minden népének .
Dan	9	7	teneked , Uram , igazság , nekünk kedig orcának gyászolatja , miként vagyon e  nap Júda férfiának és Jeruzsálem lakozóinak és mind Izraelnek , azoknak , kik közel vannak , és azoknak , kik messze vannak minden földeken , kikre kivettél minket ő hamisságokért , kikkel bűnhettek tebenned , Uram .
Dan	9	8	nekünk kedig orcának gyalázata , és mi királyainknak és mi fejedelmeinknek és mi atyáinknak , kik bűnhettenek .
Dan	9	9	teneked kedig , mi Urunk Istenünknek irgalmasság és könyörület , mert elmentünk tetőled ,
Dan	9	10	és nem hallgattuk mi Urunk Istenünknek szavát , hogy járnánk ő törvényében , melyet vetett minekünk , ő szolgái miatt , próféták miatt , mi Urunk Istenünk .
Dan	9	11	és mind Izrael törvényt tört te törvényedben , és elhajlottanak , hogy ne hallgatnák te szavadat , és csepegett miránk átok és utálat , mely írván vagyon Mózesnek , Isten szolgájának könyvében , mert bűnhettünk őneki .
Dan	9	12	és állaptatta ő beszédeit , kiket beszélt , miránk  és  mi fejedelmeinkre , kik kik ítéltenek minket , hogy miránk hoznák e  nagy gonoszt , mely soha nem volt minden menny alatt .
Dan	9	13	mi szerint lett Jeruzsálemben , mi szerint írván vagyon , írván vagyon Mózesnek törvényében , mind e  gonosz jött miránk , és nem kértük te orcádat , mi Urunk Istenünk , hogy elfordulnánk mi hamisságunkból , és gondolnánk te igazságodat .
Dan	9	14	és vigyázott Úr a gonoszságra , és elhozta őtet miránk , igaz mi Urunk Isten ő minden művelkedetében , melyeket tett , mert nem hallgatjuk ő szavát .
Dan	9	15	és ma mi Urunk Isten , ki kihoztad te népedet Egyiptomnak földjéből erős kézben , és tettél temagadnak nevet e  nap szerint , bűnhettünk , hamisságot tettünk ,
Dan	9	16	Uram , te minden igazságodban , unszollak , forduljon el te haragod és te hirtelenkedeted te városodról , Jeruzsálemről , és te szent hegyedről . mert mi bűneinkért és mi atyáinknak hamisságaiért Jeruzsálem  és te néped bosszúságban vannak mindeneknek körül valóknak .
Dan	9	17	azért ma , mi Urunk , hallgassad meg te szolgádnak imádságát  és ő unszolatát , és mutassad te orcádat te sanctuariumodra , mely megpusztultatott .
Dan	9	18	én Istenem , tennenérted hajtsad te füledet , és hallgass meg , nyissad meg te szemeidet , és lássad meg mi pusztulatunkat és a várost , kin hívattatott te neved , mert nem mi igazolatainkban terjesztünk le unszolatokat te orcád előtt , de te   sok irgalmazataidban .
Dan	9	19	hallgass meg , Uram , és engeszteltessél meg , Uram , figyelmezzed , Uram , és tegyed , ne késsél tennenérted , mi Istenünk , mert te neved hívattatott e  városon és te népeden .
Dan	9	20	mikor megszólnék , és imádkoznám , és vallanám én bűneimet és én népemnek , Jeruzsálemnek bűneit , hol leterjeszteném én unszolataimat én Istenemnek személye előtt én Istenemnek szent hegyeiért ,
Dan	9	21	míg én beszéllettem ez imádságban , íme , Gábriel férfiú , kit kezdetben láttam vala a látatban , hamar repülvén illete engemet esti áldozatnak idején .
Dan	9	22	és taníta engemet , és beszéle énnekem , és mondá : Dániel , ma azért jöttem ki , hogy tanítanálak tégedet , hogy értenéd .
Dan	9	23	te unszolataidnak kezdeteitől fogván ment ki e  beszéd , én kedig jöttem , hogy megjelenteném teneked , mert áhítatoknak vagy férfia , te kedig figyelmezzed e  beszéd , és értsed meg e  látatot .
Dan	9	24	a hetven hetek megrövidültek te népeden és te szent városodon , hogy megvégeztetnék a törvénytörés , és véget vegyen a bűn , és eltörlettessék a hamisság , és elhozattassék az örök igazság , hogy beteljesedjék a látat és a prófécia , és    megkenettessék szenteknek szentje .
Dan	9	25	tudjad azért , és elméddel figyelmezzed a beszédnek kimenetétől fogva , hogy ismét megrakattatik Jeruzsálem , Krisztus vezériglen hét hetek és ötvenkét hetek lesznek , és ismét megrakattatik Jeruzsálem , utcák és kőfalak időknek nehézségeiben .
Dan	9	26	és hatvankét hét , hetek után megölettetik Krisztus , és nem leszen ő népe , ki őtet megtagadta . és a várost és a sanctuariumot eltékozlá a nép ő jövendő vezérével , és ő végzete pusztulat , és a hadnak vége után állaptatik a pusztulat .
Dan	9	27	megerősíti kedig a fogadást sok hetekben , egy a heteknek közepében megfogyatkozik ostya és áldozat , és a templomban  leszen a pusztulatnak undoklata , és mind a megtökélletiglen és végiglen megmarad a pusztulat .
Dan	10	1	Cirusznak , perzsiaiak királya országlatának harmad esztendejében ige jelentetett Dánielnek , ki neveztetett vala Baltazárnak , nagy ige és nagy erősség , és megértém a beszéd , mert értelem kellemetesség a látatban .
Dan	10	2	az napokban én , Dániel , gyászolkodom vala három heteknek napjaiban ,
Dan	10	3	kívánatos kenyeret nem ettem , és hús és bor én számon be nem ment , de ingyen kenettel sem kenettettem meg , mígnem beteljesednének három heteknek napjai .
Dan	10	4	a huszad napon kedig  és az elő hónak XIV . napján valék a nagy folyó mellett , ki mondatik Tigrisnek .
Dan	10	5	és felemelém én szemeimet , és láték , és íme egy férfiú , ruháztatott lenruhákkal és ő farcsikai megszoríttattak fényes arannyal ,
Dan	10	6	és ő teste monnal krizolit , és ő orcája monnal villamatnak  személye , és ő szemei mint   égő lámpás , és ő karjai és melle alább lábáiglan monnal fénylő ércnek személye , és ő beszédének szózata mint sokaságnak szózata .
Dan	10	7	én kedig , Dániel , ennenmagam látám e  látatot , valóbizony a férfiak , kik énvelem valának , nem láták , de igen nagy félelem esett vala őrájuk , és elfutának rejtekbe .
Dan	10	8	én kedig ennenmagam meghagyattatvám , látám e  nagy látatot , és nem marada meg énbennem erősség , de én személyem is  megváltoztaték énbennem , és megerőtlenülék , de sem marada énbennem valami erő .
Dan	10	9	és hallám ő beszédének szavát , és hallván fekszek vala szomorodván én orcámon , és én személyem  egyesült vala földhöz .
Dan	10	10	és íme , kéz illete engemet , felemele engemet én térdeimre és én kezemnek ujjaira .
Dan	10	11	és mondá énnekem : Dániel , ájtatosságoknak férfia , értsed az igéket , melyeket én beszélek teneked , és állj fel igazulván , és ma eresztettem tehozzád . és mikor mondta volna énnekem e  beszédet , felállék  reszketvén .
Dan	10	12	és mondá énnekem : Dániel , ne akarj félned , mert az elő naptól fogva , kiben vetted te szívedet értelemre , hogy temagadat gyötörnéd te Istenednek személye előtt , meghallattatának te igéid , és én jöttem te beszédeidért .
Dan	10	13	perzsiaiak országának kedig fejedelme ellent állott énnekem huszonegy napokban , és íme Mihály , egy az elő fejedelmek közül , jöve én segedelmemre , és én ottan maradék perzsiaiak királya mellett .
Dan	10	14	jövök kedig , hogy tanítanálak tégedet , melyek jövendők legyenek te népednek az utolsó napokban , mert megy e  látás elhosszabbíttatik napokra .
Dan	10	15	és mikor beszélne énnekem ilyennemű igéket , leeresztém én személyemet a földre , és veszteglék .
Dan	10	16	és íme , monnal ember fiának személye illeté én ajkaimat , és megnyitván én számat , szólék , és mondék őneki , ki áll vala énellenem : én Uram , te látásodban megfeslettenek én ízeim , és énbennem sem egy erő nem marada .
Dan	10	17	és miképpen szólhat én Uramnak szolgája én Urammal ? sem egy erő nem maradt énbennem , de én lélekletem is  berekesztetik .
Dan	10	18	azért ismét illete engemet monnal embernek látása , és megbátoríta engemet ,
Dan	10	19	és mondá : ne akarj félned , ájtatosságoknak férfia , békesség teneked , bátorodjál meg , és légy erős ! és mikor beszélne énvelem , megélemedém , és mondék : szólj , én Uram , mert megbátorítál engemet .
Dan	10	20	és mondá : nemde tudod -e , mire jöttem tehozzád ? és ma megfordulok , hogy vívjak a perzsiaiak fejedelme ellen , mert is mikor kimennek , jelenék a görögök fejedelme  jővén .
Dan	10	21	valóbizony meghirdetém teneked , mely kijelentetett igazságnak írásaiban , és senki nincsen én   segedelmem mindezekben , hanem csak Mihály , ti fejedelmetek .
Dan	11	1	én kedig médusi Dárius királynak elő esztendejében  állok vala , hogy megbátorodnék , megerősíttetnék .
Dan	11	2	és ma igazságot hirdeték teneked , és íme , míglen három királyok állapnak Perzsiában , és a negyed gazdagságokkal mindenek felett igen meggazdagultatik , és mikor meghatalmazandik ő gazdagságában , rezzeszti őellene görögöknek országát .
Dan	11	3	felkel kedig erős király , és uralkodik sok hatalmakkal , és teszi , mely kelletendik őneki . 
Dan	11	4	és mikor állapandik , megtörettetik ő országa , és osztatik mennynek négy szélébe , de nem ő maradékaiban , sem uralkodót annak hatalma szerint , ki uralkodandó , mert megszaggattatik ő országa kívül valókra , és  azoktól megválván .
Dan	11	5	és megbátorodik délszaki király , és ő fejedelmeiből hatalmazik őellene , és uralkodik hatalommal , mert sok ő uralkodata .
Dan	11	6	és az esztendőknek vége után megegyesültetnek , és délszaki királynénak leánya jő észfeknek királyához barátságot tenni , és nem vallhatja ő karjainak erősségét , sem állapik meg ő magzata , és ő eladattatik , és kik elhozták őtet , ő ifjai , és kik megbátoríták vala őtet időkben . 
Dan	11	7	és megállapik ő gyökerének nemzéséből való plántálás , és jő hadból , és bemegyen észfek királyának vidékébe , és visszaéltettetik azokkal , és megnyeri .
Dan	11	8	afelett ő isteneket és bálványokat és aranynak és ezüstnek drágalátos edényeit fogván viszi Egyiptomba , ő hatalmazik észfek királya ellen .
Dan	11	9	és észfeknek királya bemegyen az országba , és megfordul ő földjébe .
Dan	11	10	ő fiai kedig megrezzesztetnek ,  és nagy seregeknek sokaságát gyűjtik egybe , és jő sietelmezvén és áradván , és megfordul , és megrezzesztetik , és vív ő erejével .
Dan	11	11	és megrezzesztetvén észfeknek a megmondott királya kimegyen , és vív észfek királya ellen , és készít igen nagy sokaságot , és a sokaság adattatik ő kezébe .
Dan	11	12	és megfogja a sokaságot , és felmagasztatik ő szarva , és sokezreket ejt le , de nem hatalmazhatik .
Dan	11	13	mert megfordul észfeknek királya , és sokaságot készít , naggyal nagyobbat , hogy nem azelőtt , és időknek és esztendőknek végében jő sietelmezvén nagy sereggel és igen nagy gazdagságokkal .
Dan	11	14	és az időkben sokan támadnak délszak királya ellen , és te törvénytörő népednek fiai felmagasztatnak ,  hogy betöltsék e  látatot , és leesnek .
Dan	11	15	és jő észfeknek királya , és egybegyűjti a rakást , és megveszen erős kőfalas  városokat , és délszaknak karjai nem szenvednek , és feltámadnak ő választottai ellent állani , és nem leszen erősség .
Dan	11	16	és jővén teszen őrajta ő akarata   szerint , és nem leszen , ki álljon ő orcája ellen , és állapik a fényes földön , és megemésztetik ő kezében .
Dan	11	17	és veti ő orcáját , hogy jöjjön ő minden országát megtartani , és igazakat teszen ővele , és némbereknek leánya adja őneki , hogy elfordítsa azt , és nem állapik meg , sem leszen azé .
Dan	11	18	 és fordítja ő orcáit szigetekre , és sokakat veszen meg , megszünteti a fejedelmet ő bosszúságaiból , és ő bosszúsága őbeléje fordul .
Dan	11	19	és fordítja ő orcáját ő földjének hatalmába , és leesik , és megtöri ,  és nem lelettetik meg .
Dan	11	20	és áll ő helyén az igen gonosz és méltatlan királyi ékességgel , és kevés napokban megtörettetik , és nem haragban , sem hadban .
Dan	11	21	és ő helyén állapik az  utálatos , és nem adatik őneki királyi tisztesség , és jő titkon , és megveszi az országot csalárdsággal .
Dan	11	22	és a vívónak karjai kivívatnak ő orcájától , és megtörettetnek , afelett és a békességnek hercege .
Dan	11	23	a barátságok után álságot teszen ővele , és felmegyen , és meggyőzi kevés néppel .
Dan	11	24	és bemegyen a bővelkedő és az gazdag városokba , és teszi , melyeket ő atyái nem tettenek  és ő szüleinek atyái : ragadozatokat és foszlatot , és ő erősségű gondolatai ellen tart tanácsot  és ez ideiglen .
Dan	11	25	és felrezzesztetik ő félelme és ő szíve délszak királya ellen nagy seregben , és délszak királya hadba rezzesztetik sok segedelmekkel és igen erősségekkel , és nem állhatnak , mert tanácsokat tartanak őellene .
Dan	11	26	és kenyeret esznek ővele , és megtörik őtet , és ő hada megnyomoríttatik , és leesnek ő sok gondolatai .
Dan	11	27	és a két királyoknak szívük egy leszen , hogy gonoszul tegyenek , és egy asztalnál beszélnek hazugságot , és nem  használnak , mert megy a végezet egyéb időre .
Dan	11	28	és megfordul ő földjébe sok gazdagságokkal , és ő szíve a szent testamentum ellen , és teszen , és megfordul ő földjébe .
Dan	11	29	szerzett időben , és megfordul , és jő délszakra , és az utolsó  nem leszen egyenlő az elsővel .
Dan	11	30	és jőnek őrája háromszor evezős hajók és a rómaiak , és megverettetik , és megfordul , és méltatlankodik a sanctuariumnak testamentuma ellen , és teszen , és megfordul , és gondol azok ellen , kik meghagyták a sanctuariumnak testamentumát .
Dan	11	31	és karok őbelőle állapnak , és megfertőztetik őbelőle erősségnek sanctuariuma , és a tökéletes áldozat elvettetik , és adattatnak az undoklatok pusztulatba .
Dan	11	32	és a hamisak testamentumot hasonlanak csalárdságost , ő Istenét tudó nép kedig nyer , és teszen .
Dan	11	33	és a népekben tanultak sokakat tanítanak , és tőrben esnek le és lángban és fogságban és napoknak ragadozatában .
Dan	11	34	és mikor leesendenek , felemeltetnek kicsinyed segedelemmel , és sokan egyesülnek ővele csalárdságost .
Dan	11	35	és a tanultakból leesnek , hogy megolvasztassanak , és megkötöztetnek , és megfehérültetnek a szerzett ideiglen , mert még egyébnemű idő  leszen .
Dan	11	36	és a király ő akarata   szerint teszen , és felemeltetik , és felmagasztatik minden isten ellen , és istenek Istene ellen nagyokat szól , és viseltetik , míglen beteljesedjék a harag , megtettetett kedig a végezet .
Dan	11	37	és ő atyáinak Istenét nem vívja ki , és leszen némbereknek kívánságaiban , és sem egy istenekkel nem gondol , és mert mindenek ellen támad .
Dan	11	38	Moábnak kedig istene ő helyén tiszteltetik , és az  istent tiszteli , kit ő atyái nem tudtanak , arannyal és ezüsttel és drágalátos kővel és drágalátos vagyonokkal .
