Jo	2	13	és metéljétek meg ti szíveteket , és forduljatok ti Uratok Istenhez , mert kegyes és irgalmas , engedelmes és sok irgalmasságú , és felséges , irgalmas gonoszságokon .
Jo	2	14	ki tudja , ha megforduljon , és bocsásson Isten , és adjon őutána áldomást , áldozat és ajánlat mi Urunk Istennek ?
Jo	2	15	énekeljetek trombitával Sionban , szenteljetek böjtöt , hívjatok sereget ,
Jo	2	16	egybegyűjtsetek népet , szenteljetek egyházat , egybehívjatok véneket , egybegyűjtsetek aprókat  és emlőket szopókat , kimenjen a vőlegény ő hajlékából  és menyasszony ő terméből .
Jo	2	17	az oltár és a gádor között sírnak papok , Úrnak szolgái ,  és mondanak : engedj , Uram , engedj te népednek , és ne adjad te örökletedet bosszúságba , és ne uralkodjanak nemzetek őrajtuk , mert mire mondják a népekben : hol vagyon ő Istenük ?
Jo	2	18	Úr szerette ő földjét , és megengedett ő népének ,
Jo	2	19	és felelt Úr , és mondott ő népének : íme én ereszték tinektek gabonát , bort , és olajat , és beteljesedtek őbennük , és nem adlak titeket továbbá nemzetekben bosszúságba .
Jo	2	20	és őtet , ki észfekről vagyon , messze teszen titőletek , és kiűzöm őtet a földbe , az útba  és pusztába , és orcáját napkeleti tenger ellen , és ő utolját az utolsó tengerre , és felmegyen ő bűze , és felmegyen ő rothadatossága , mert kevélyül művelkedett .
Jo	2	21	ne akarj félned , föld , de vigadj ,  és örülj , mert felmagasztatta Úr , hogy tegye .
Jo	2	22	ne akarjátok félnetek a vidéknek lelkeseit , mert a kietlennek drágalátosai nemzettenek , mert a fa hozta ő gyümölcseit , a füge és a szőlő adták ő erejüket .
Jo	2	23	és Sionnak fiai , vigadjatok , és örüljetek ti Uratok Istenben , mert adta tinektek igazságnak tanítóját , és leszállítja tirátok veternyei harmatot és estit , miként kezdettől fogván .
Jo	2	24	és a szérűk beteljesednek gabonával , és a sajtók  bővelkednek borral és olajjal .
Jo	2	25	és megadom tinektek az esztendőket , kiket megevett a sáska , a csajva , a ragya és a hernyó , nagy én erősségem , kit eresztettem tihozzátok .
Jo	2	26	és esztek éltettetvén , és megelégedtek , és dicséritek ti Uratok Isteneteknek nevét , ki tett csodákat tiveletek , és nem gyaláztatik meg én népem örökké .
Jo	2	27	és tudjátok , mert én Izrael közepett vagyok , és én ti Uratok Istenetek , és nincs nagyobb , és én népem nem gyaláztatik meg örökké . kapitulum harmad  
Jo	2	28	és leszen ezek után : öttöm én szelletemet minden testre , és ti fiaitok és ti leányotok prófétálnak , ti vénetek álmokat álmodoznak , és ti ifjaitok látatokat látnak .
Jo	2	29	de is  a napokban öttöm én szelletemet is én szolgálóleányaimra .
Jo	2	30	és adok csodákat mennyen és földön , vért és tüzet és füstnek páráit .
Jo	2	31	nap sötétségekbe fordul  és hold vérbe , mielőtt eljöjjön Úrnak nagy napja  és félelmes .
Jo	2	32	és leszen : minden , valaki kiáltandja Úrnak nevét , üdvözül , mert Sionnak hegyén és Jeruzsálemben leszen az üdvözülés , miként mondott Úr , és a maradékokban , kiket Úr hívand .
Jo	3	1	mert íme , a napokban és az időben , mikor megfordítandom Júdának és Jeruzsálemnek fogságát , 
Jo	3	2	egybegyűjtök minden nemzeteket , és viszem őket Jozafátnak völgyébe , és ottogyol vetekedem ővelük , Izraelen , én népemen , és én örökletemen , kiket elhimtettenek nemzetekbe , és én földemet megosztották ,
Jo	3	3	és én népemen nyilat eresztettenek , és a gyermeket vették a bordélyba , és a leányt eladták boron , hogy innának .
Jo	3	4	valóbizony mi énnekem és tinektek Tírusz és Szidon  és palesztinaiaknak minden határai ? midőnen győzedelmet forbátoltok meg énnekem -e ? és ha ti énellenem győzedelmeztek , hamar és gyorsan megadom tinektek a megforbátolást ti főtökre .
Jo	3	5	mert én ezüstömet és én aranyamat elvettétek , és én kívánatosaimat és én szépeimet adtátok ti bálványotoknak egyházába .
Jo	3	6	és Júda fiait és Jeruzsálem fiait eladtátok a görögök fiainak , hogy messze tennétek őket ő határuktól .
Jo	3	7	íme én feltámasztom őket a helyen , kiben eladtátok őket , és fordítom a ti megforbátolásotokat tin főtökre .
Jo	3	8	és elárulom ti fiaitokat és ti leányotokat Júda fiainak kezükbe , és elárulják őket sábaiaknak , igen messze való nemzetnek , mert Úr Úr beszélte .
Jo	3	9	üvöltsétek ezt nemzetekben , szenteljetek hadat , támasszátok fel az erőseket ,  felmenjenek minden hadakozó férfiak .
Jo	3	10	törjétek meg ti szántóvasaitokat tőrökbe , és ti kapáitokat lándzsákba . a beteg mondjon : mert én erős vagyok .
Jo	3	11	fakadozzatok , és jöjjetek minden nemzetek körül , és egybegyülekezzetek ott , és leejti Úr te erőseidet .
Jo	3	12	keljenek fel nemzetek , és menjenek fel Jozafátnak völgyébe , mert ottogyol ülök , hogy körül minden nemzeteket megítéljek .
Jo	3	13	eresszétek ti sarlótokat , mert megért az aratás , jöjjetek , és szálljatok le , mert teljes a sajtó , és bővelkednek a sajtók , mert megsokasult ő gonoszságuk .
Jo	3	14	a népek öldökleteinek völgyében , mert közel Úrnak napja a válasznak völgyében .
Jo	3	15	nap és hold megsötétesültek , és csillagok megvonták ő fényességüket .
Jo	3	16	és Úr Sionból rí és Jeruzsálemből adja ő szavát , és mennyek megindultatnak és föld , és Úr leszen ő népének  reménysége  és Izrael fiainak  erőssége .
Jo	3	17	és tudjátok , mert én vagyok ti Uratok Istenetek , Sionban , én szent hegyemen lakozó , és leszen Jeruzsálem szent , és idegenek továbbá nem mennek őáltala .
Jo	3	18	és leszen az napon : hegyek édességet hullatnak , és völgyek tejjel folynak , és Júdának minden csergetegeiben vizek folynak , és forrás kimegyen  Úrnak házából , és megöntözi az áradatnak  töviseit .
Jo	3	19	Egyiptom pusztulatba leszen és Idumea veszedelemnek pusztaságába azért , hogy hamisan művelkedtenek Júda fiaiban , és az ártatlannak vérét elöntötték ő földjükben .
Jo	3	20	és Júdea lakoztatik mindörökké és Jeruzsálem nemzetekből és nemzetekbe .
Jo	3	21	és megtisztítom ő vérüket , kit meg nem tisztítottam vala , és Úr lakozik Sionban .
Am	1	1	Ámosznak igéi , ki ki volt Tekoának pásztoraiból , melyeket látott Izraelre , Ozeásnak , Júda  királyának napjaiban , és Jerobeámnak , Joás fiának , Izrael  királyának napjaiban , két esztendővel előtte a földindulásnak .
Am	1	2	és mondá : Úr Sionból rí , és Jeruzsálemből adja ő szavát , és sírtanak pásztoroknak drágalátosai , és megaszott Kármelnek teteje .
Am	1	3	ezt mondja Úr : Damaszkusznak három bűnein  és a negyediken nem fordítom meg őket  azért , hogy Gileádot vas nyomtató készséggel törte légyen meg .
Am	1	4	és eresztek tüzet Hazaelnek házába , és megmarja Ben-Hadadnak házát .
Am	1	5	és megtöröm Damaszkusznak závárait , és elvesztem a bálvány mezejében lakozókat  és istápot tartót gyönyörködetnek és beléndességnek házából , és elvitettetik Szíriának népe Kirbe , úgy mond Úr .
Am	1	6	ezt mondja Úr : gázának három fertőzetességein  és a negyediken nem fordítom meg őtet  azért , hogy elvitte légyen a tökéletes fogságot , hogy berekesztené őtet Idumeába .
Am	1	7	és eresztek tüzet Gázának kőfalára , és megmarja ő házait .
Am	1	8	és elvesztek Asdodban lakozókat  és istápot tartót Aszkalonból , és fordítom én kezemet Ekronra , és elvesznek a jászoknak maradékai , úgy mond Úr .
Am	1	9	ezt mondja Úr Isten : Tírusznak három bűnein  és a negyediken nem fordítom meg őket azért , hogy a tökéletes fogságot  berekesztették Idumeába , és nem emlékeztenek meg atyafiaknak fogadásáról .
Am	1	10	és eresztek tüzet Tírusznak kőfalába , és megmarja ő házukat .
Am	1	11	ezt mondja Úr : Edomnak három bűnein  és a negyediken nem fordítom meg őtet  azért , hogy tőrrel  üldözte légyen ő atyjafiát , és megtörte ő irgalmasságát , és továbbá megtartotta légyen ő hirtelenkedetét , és ő haragját megtartotta mindvégiglen .
Am	1	12	eresztek tüzet Temánba , és megmarja Boszrának házát .
Am	1	13	ezt mondja Úr : Ammon fiainak három fertőzetességein  és a negyediken nem fordítom meg őtet azért , hogy Gileádnak nehézkeseit megmetélte ő határának megszélesítésére .
Am	1	14	és tüzet gerjesztek  Rabbatnak , másként Rabbának kőfalába , és megmarja ő házát ordításban hadnak és homálynak napján és az indulásnak napján .
Am	1	15	és megyen Milkom fogságba , ő és  ő fejedelmei egyembe , úgy mond Úr .
Am	2	1	ezt mondja Úr Isten : Moábnak három fertőzetességein  és a negyediken nem fordítom meg őtet  azért , hogy Idumea királyának tetemeit megégette mind hamuiglan .
Am	2	2	és eresztek tüzet Moábba , és megmarja Kerijjotnak házát , és meghal Moáb a szózatban  és trombitának üvöltésében .
Am	2	3	és elvesztek bírát ő közepéből , és ő minden fejedelmeit megölöm ővele , úgy mond Úr . kapitulum 4 .  
Am	2	4	 ezt mondja Úr Isten : Júdának három fertőzetességein  és a negyediken nem fordítom meg őtet  azért , hogy elvették Úrnak törvényét , és ő parancsolatait nem őrizték , mert megcsalták őket ő bálványai , kik után jártanak ő atyjuk .
Am	2	5	és eresztek tüzet Júdába , és megmarja Jeruzsálemnek házát .
Am	2	6	ezt mondja Úr : Izraelnek három fertőzetességein és a negyediken nem fordítom meg őtet  azért , hogy az igazat ezüstön eladta  és a szegényt láböltözőn .
Am	2	7	kik megtörik szegényeknek fejüket földnek pora felett , és alázatosoknak útját eltávoztatják , és fiú és ő atyja bementenek a leányhoz , hogy megtörnék én szent nevemet .
Am	2	8	és a szalagba vetett ruhákon feküdtenek minden oltár szerint , és kárhozottaknak borát isszák vala ő Istenüknek házában .
Am	2	9	én kedig kiirtottam amoreust ő orcájuk elől , kinek cédrusuknak magassága ő magassága , és ő erős monnal cserefa , és megtörtem felül ő gyümölcsét  és alatt ő gyökereit .
Am	2	10	én vagyok , ki felmentettelek titeket Egyiptomból , és vittelek titeket a  kietlenbe negyven esztendeiglen , hogy bírnátok amoreusnak földjét .
Am	2	11	és feltámasztottam ti fiaitokból prófétákba  és ti ifjaitokból nazireusokat : midőnen úgy vagyon -e , Izraelnek fiai ? úgy mond Úr .
Am	2	12	és a nazireusoknak adtok vala bort , és a  prófétáknak parancsoltok vala mondván : ne prófétáljatok !
Am	2	13	íme én csikorgatok tirátok , miként csikorog a szénával megterheltetett szekér .
Am	2	14	és futás elvész a gyorstól , és erős nem bírja ő tehetségét , és erős nem szabadítja meg ő lelkét ,
Am	2	15	és íjat tartó nem állhat , és ő lábaiban gyors nem szabadulhat meg , és lóra ellő nem szabadíthatja meg ő lelkét ,
Am	2	16	és a napon szívvel erős  az erősek között mezítelen fut el .
Am	3	1	hallgassátok  az igét , melyet Úr beszélt tirátok , Izraelnek fiai , minden rokonságaira , melyet kihoztam Egyiptomnak földjéből , mondván :
Am	3	2	csak titeket ismertelek földnek minden nemzeteiből , azért meglátom tirátok ti minden hamisságotokat .
Am	3	3	mindenen egyembe járnak -e ketten , hanem ha illendik őnekik ?
Am	3	4	midenem rí -e oroszlán a ligetben , hanem ha ragadozatot valland ? midőnen oroszlánnak kölyke adja ő szavát -e ő barlangjából , hanem ha ragadand valamit ?
Am	3	5	midőnen esik madár e  földnek tőrébe madarász nélkül ? midőnen elvettetendik -e a tőr a földről , mielőtt valamit fogjon ?
Am	3	6	és ha éneklend a trombita a városban , és a  nép meg nem ijed ? ha nem leszen gonosz a városban , kit Úr nem teend ?
Am	3	7	mert nem teszi Úr Isten az igét , hanem ha megjelentendi ő titkát ő szolgáinak , prófétáknak . 
Am	3	8	rí az oroszlán , ki nem fél ? Úristen beszélt , ki nem prófétál ?
Am	3	9	hallandván tegyetek Asdodnak városaiban és Egyiptom földjének városaiban , és mondjátok : egybegyűjtőzzetek Szamariának hegyeibe , és lássátok a sok balgatagságokat őközepette  és patvart szenvedőket ő rejtekeiben .
Am	3	10	és nem tudtanak igazat tenni , úgy mond Úr , hamisságot és ragadozatot kincseznek ő házukban .
Am	3	11	azért ezt mondja Úr Isten : megtöredelmeztetik , és megkörnyékeztetik a föld , és levontatik tebelőled te erősséged , és elragadtatnak te házaid .
Am	3	12	ezt mondja Úr : miként ha a pásztor elragadand oroszlánnak szájából két szárakat avagy fülnek végét , ígyen ragadtatnak el Izraelnek fiai , kik lakoznak Szamariában én ágyacskámnak csapásában  és Damaszkusznak ágyában .
Am	3	13	hallgassatok , és valljatok Jákob házában , úgy mond seregeknek Ura Istene . 
Am	3	14	mert a napon , melyen kezdendem meglátnom Izraelnek törvénytörését , őrája látom meg  és Bételnek oltáraira , és elvágattatik az oltárnak szarvai , és esnek a földre .
Am	3	15	és megverem a téli házat a nyári házzal , és elvesznek az elefánttetemből alkotott házak , és sok házak tékozlatnak el , úgy mond Úr .
Am	4	1	hallgassátok ez igét , kövér ünők , kik vagytok Szamariának hegyében ,  kik patvart tesztek nyavalyásoknak , és megtörtök szegényeket , kik mondjátok ti uraitoknak : hozzatok , és iszunk .
Am	4	2	esküdt Úr Isten ő szentjében , mert íme napok jönnek tirátok , és felemelnek titeket  és ti megmaradékotokat forró fazekakban .
Am	4	3	és az réseken kimentek egyiktek mások ellen , és vettettek Hermonba , úgy mond Úr .
Am	4	4	jövetek Bételbe , és hamisan művelkedjetek Gilgalba , és sokasítsátok meg a törvénytörést , és ajánljátok holval ti áldomásotokat .
Am	4	5	és áldozzatok a kovászból dicséretet , és hívjátok akaratos áldozatoknak , és hirdessétek meg , mert így akartátok , Izrael fiai , úgy mond Úr Isten .
Am	4	6	azért én is  adtam tinektek fogaknak félelmét ti minden városotokban és kenyérnek szükségét ti minden helyetekben , és nem fordultatok énhozzám , úgy mond Úr .
Am	4	7	és én megtiltottam titőletek az esőt , mikor még három hónapok volnának aratásiglan , és esék egy városra , és másikra nem esék : egy rész megöntöztetett , és  a rész , melyre nem estem , megaszott .
Am	4	8	és jövének két és három városok az egy városba , hogy innának vizet , és nem elégedtenek meg , és nem fordulátok énhozzám , úgy mond Úr .
Am	4	9	megvertelek titeket aszaló széllel és ragyával  ti kerteteknek sokaságát  és ti szőlőiteket , és ti olajkerteteket és ti fügekerteteket hernyó ette meg , és nem fordulátok énhozzám , úgy mond Úr .
Am	4	10	ereszték tibelétek halált  Egyiptomnak útjában , tőrrel megverem ti ifjaitokat  mind ti lovaitoknak fogságáig , és felmentetém ti szállásotoknak bűzét ti orrotokba , és nem fordulátok énhozzám , úgy mond Úr .
Am	4	11	elfordítalak titeket , miként Úr elfordította Szodomát és Gomorrát , és lettetek miként a tűzből kiragadtatott  üszök , és nem fordulátok énhozzám , úgy mond Úr .
Am	4	12	azért ezeket teszem teneked , Izrael , úgy mond Úr , miután kedig ezeket teendem teneked , készítsed temagadat , Izrael , te Istenednek elébe .
Am	4	13	mert íme , én teszek hegyeket , és teremtek szelet , és hirdetem embernek ő beszédét , teszem a veternyei ködöt , és járok földnek magasságán , seregeknek Ura Istene ő neve .
Am	5	1	hallgassátok ez igét , kivel emelek tirátok siralmat . Izraelnek háza leesett , és nem toldatik , hogy felkeljen .
Am	5	2	Izraelnek szüze levettetett ő földjébe , nincsen , ki felkeltse őtet .
Am	5	3	mert ezt mondja Úr Isten : a város , kiből ezrek kimennek vala , meghagyattatnak őbenne százan , és kiből kimennek vala százan , hagyattatnak őbenne tízen Izraelnek házában .
Am	5	4	mert ezt mondja Úr Isten Izrael házának : keressetek engemet ,  és éltek .
Am	5	5	és ne akarjátok keresnetek Bételt , és Gilgalba ne akarjatok mennetek  és Beersebába bemennetek , mert Gilgal fogságban vitettetik el , és Bétel kelletlen leszen .
Am	5	6	keressétek Urat , és éljetek , netalántán megégettessék Józsefnek háza , mint tűz  is megmarja , és nem leszen , ki megoltsa Bételt .
Am	5	7	ki örömbe fordítá az ítéletet , és Úrnak igazságát meghagyjátok a földön .
Am	5	8	Arcturust tett és Oriont , és sötétségeket holvalba fordított , és napot éjbe változtatott , ki hívja tengernek vizeit , és ki önti azokat földnek színére : Úr ő neve ,
Am	5	9	megneveti a pusztulatot az erősön , és a fosztást a hatalmasra hozza .
Am	5	10	gyűlölségben vallották a kapuban megfeddőt , és a tökéletesen beszélőt megutálták .
Am	5	11	azért , hogy megnyomorítjátok vala a szegényt , és a választott foszlatot elveszitek vala őtőle , házakat négyszögű kővel raktok , és nem lakoztok őbennük , igen szerelmes szőlőket plántáltok , és nem isszátok ő borát .
Am	5	12	mert én ismertem ti sok fertőzetességeteket  és ti erős bűnötöket , igaz ellenségek ajándékokat vesztek , és szegényeket a kapuban  megnyomorgattok .
Am	5	13	azért ildomos az időben vesztegel , mert az  idő gonosz .
Am	5	14	keressetek jót és ne gonoszt , hogy éljetek , és seregeknek  ura Istene tiveletek leszen , miként mondotta .
Am	5	15	gyűlöljetek gonoszt , és szeressetek jót , és szerezzétek a kapuban az ítéletet , ha talántal József maradékainak irgalmazzon seregeknek Ura Istene .
Am	5	16	azért ezt mondja seregeknek uralkodó Úr Istene : minden utcákban siralom és mindenekben , kik kívül vannak , mondatik : jaj , jaj . és a szántókat hívják gyászolatra és azokat siralomra , kik tudnak sírni .
Am	5	17	és minden utakban leszen siralom , mert általmegyek teközepetted , úgy mond Úr .
Am	5	18	jaj Úrnak napját kívánóknak , mire akarjátok őtet ? Úrnak ez napja sötétség és nem világosság .
Am	5	19	miképpen ha ember elfutand oroszlánnak orcájától , és elébe keljen őneki medve , és bemenjen a házba , és megtámaszkodjék ő kezével a falhoz , és megmarja őtet zomak .
Am	5	20	midőnen nem sötétsége Úrnak napja és nem világ  és homály és nem fényesség őbenne .
Am	5	21	gyűlöltem , és elvettem ti ünnepnapotokat , és nem veszem ti seregeteknek illatát .
Am	5	22	hogyha ajánlandotok énnekem áldomásokat , és ti ajándékotokat nem veszem , és ti kövéreteknek fogadását nem veszem .
Am	5	23	vegyed el éntőlem te énekeidnek zajgását , és te igric készségeidnek énekeit nem hallgatom meg .
Am	5	24	és megjelentetik  az ítélet monnal erős áradat .
Am	5	25	midőnen ostyákat és áldozatokat ajánlottatok énnekem a kietlenben  negyven esztendeiglen -e , Izraelnek háza ?
Am	5	26	és viseltétek Molochnak hajlékát ti isteneteknek és bálványotoknak képét , ti isteneteknek csillagát , melyeket tettetek timagatoknak .
Am	5	27	és elmentetlek titeket Damaszkusz elvé , úgy mond seregeknek Ura ő neve .
Am	6	1	jaj nektek , kik gyönyörködtetek Sionban , és bíztok Szamariának hegyébe , fejedelmek népeknek fejei járván kevélységgel Izraelnek házában .
Am	6	2	menjetek el Kalnéba , és lássátok meg , és onnan menjetek nagy Hamatba , és szálljatok le a jászoknak Gátjába  és ő országuknak mentől jobbjaiba , ha szélesebb ő határuk ti határaitoknál .
Am	6	3	kik elválasztattatok gonosz napba , és közelgettek hamisságnak székeihez ,
Am	6	4	kik alszotok elefánttetemmel alkotott ágyakban , és bujálkodtok ti ágyatokban , kik megeszitek a bárányt az apró barom csordáiból  és a borjúkat az öreg barom csordája közepéből ,
Am	6	5	kik énekeltek zsoltárnak szavában , miként Dávid , alították őmaguknak vallaniuk éneknek édeneit .
Am	6	6	íván a fiolákban bort és mentől  jobb kenettel kenettetének meg , és semmit sem szenvednek vala  Józsefnek töredelmén .
Am	6	7	azért ma elmennek az elmenőknek fejeken , és elvetettetik a bujálkodóknak tevője .
Am	6	8	esküdt Úr Isten ő lelkére , úgy mond seregeknek Ura Istene : én megutálom Jákobnak kevélységét  és ő házait gyűlöltem , és eladom a várost ő lakozóival össze .
Am	6	9	hogyha egy házban tíz férfiak leendenek , maradandanak , ők is  meghalnak .
Am	6	10	és veszi őtet ő rokona , és megégeti őket , hogy tetemeit a házból kivigye , és mond annak , ki a háznak rejtekében vagyon : midőnen vagyon -e itt melletted ?
Am	6	11	és felel : vége vagyon . és mond neki : vesztegj , és ne emlékezzél Úrnak nevéről ,
Am	6	12	mert íme Úr parancsolt , és megveri a nagyobb házat romlással  és a kisebb házat metélésekkel .
Am	6	13	mindenen futhatnak -e lovak a kőszirten , avagy szánthatnak a bivalyokon , mert az ítéletet keserűségbe fordítottátok , és igazságnak gyümölcsét ürömbe ?
Am	6	14	kik vigadtok a semmiben , kik mondtok : mi nem mi erősségünkben vettünk -e mi magunknak szarvakat ?
Am	6	15	úgy mond seregeknek Ura Istene : íme , én támasztok tirátok , Izraelnek háza , nemzetet , és megtör titeket  Hamatnak bemenetétől fogván  a kietlennek áradatáiglan .
Am	7	1	ezeket mutatá Úr Isten énnekem , és íme , sáskáknak tevője esetei és termésének kezdetében , és íme esetei a csordának nyírója után , másként királynak nyírása után .
Am	7	2	és lőn , mikor megtökéllette volna a földek füvét enni , mondék : unszollak , Uram Isten , légy kegyelmes : ki támasztja fel Jákobot , mert apród ?
Am	7	3	kegyelmeze Úr Isten ezen : nem leszen , mondá Úr Isten .
Am	7	4	ezeket mutatá Úr Isten énnekem , és íme , Úr Isten hívja az ítéletet tűzbe , és megmar sok mélységet , és megeszi egyembe a részt .
Am	7	5	és mondék : uram Isten , unszollak , nyugodjál meg , ki támasztja fel Jákobot , mert apród ?
Am	7	6	kegyelmeze Úr ezen : de ez is  nem leszen , mondá Úr Isten .
Am	7	7	és íme , Úr áll vala a  megegyenesített kőfalon , és ő kezében mészkanál .
Am	7	8	és monda Úr énnekem : mit látsz te , Ámosz ? és mondék : meszelőnek kanalát . és mondá Úr : íme , én vetem a mészkanalat Izraelnek , én népemnek közepébe , és nem toldom továbbá őtet ékesítenem .
Am	7	9	és megtörettetnek a bálványnak magasságai , és Izraelnek szenteletei megpusztultatnak , és tőrrel kelek fel Jerobeámnak házára .
Am	7	10	és ereszte Amacja , Bételnek papja Jerobeámhoz , Izraelnek királyához , mondván :  Ámosz teellened újít Izrael házának közepette , nem szenvedheti e  föld ő minden beszédeit .
Am	7	11	mert ezt mondja Ámosz : tőrben hal meg Jerobeám , és Izrael fogságban megyen el ő földjéből .
Am	7	12	és mondá Amacja Ámosznak : ki látsz másként , ó látó , menj , fuss Júdának földjébe , és egyél ottogyol kenyeret , és ottogyol prófétálj .
Am	7	13	és ne toldjad továbbá , hogy Bételben prófétálj , mert királynak szentelete és ő országának háza .
Am	7	14	és felele´ Ámosz , és monda´ Amacjának : nem vagyok próféta , nem vagyok prófétának fia , de pásztor vagyok , én szegdelvén szederfákat .
Am	7	15	és vőn engemet Úr , mikor követem vala a csordát , és monda´ Úr énnekem : menjél , és prófétálj Izraelnek , én népemnek .
Am	7	16	és ma hallgassad Úrnak igéit , te mondod : ne prófétálj Izraelre , és ne hirdess a bálvány  házára .
Am	7	17	azért ezt mondja Úr : te feleséged e  városban paráználkodik , és te fiaid és te leányaid tőrben esnek le , és te földed kötéllel mértetik meg , és  te a fertőzetes földben halsz meg , és Izrael fogságában megyen el ő földjéből .
Am	8	1	ezeket mutatá Úr Isten énnekem , és íme almáknak hordója .
Am	8	2	és monda´ Úr : mit látsz te , Ámosz ? és mondék : almáknak horgát . és monda´ énnekem Úr :  végezet jött én népemre , Izraelre , nem toldom továbbá , hogy általmenjem őtet .
Am	8	3	és a napon csikorognak a templomnak sarkai , az hébereknél palotának értsed királyénak , úgy mond Úr Isten : sokan halnak meg minden helyen , és vettetik csendesség .
Am	8	4	hallgassátok ezeket , kik megtöritek a szegényt , és megfogyatkoztatjátok földnek nyavalyásait ,
Am	8	5	mondvátok : midőn megenyél az aratás , és eladjuk mi áruinkat , és a szombat , és megnyitjuk a gabonát , hogy megkisebbítsük a mértéket , és megbővítsük a sékelt , és vessünk álnak mértékeket ,
Am	8	6	hogy a nyavalyásokat bírjuk ezüstben  és a szegényeket sarukért , és a gabonának ocsúit eladjuk .
Am	8	7	esküdött Úr Jákobnak kevélységére : ha el nem feledendem mindvégiglen ő minden művelkedetét , azaz  ő bűneit .
Am	8	8	midőnen ezen nem indultatik meg föld -e , és gyászolkodik ő minden lakozója , és felmegyen monnal minden folyó , és kivettetik , és elfoly monnal Egyiptomnak csergetege .
Am	8	9	és leszen a napon , úgy mond Úr : nap elnyugszik délbe , és világosságnak napja megsötétíti a földet ,
Am	8	10	és fordítom ti ünnepnapotokat siralomba  és ti minden éneketeket gyászolatba , és viszek ti minden hátatokra zsákot  és ti minden fejetekre kopaszlatot , és vetem őtet monnal egyetlen egy születetnek siralmát ,  és ő utoljait monnal keserűségnek napját .
Am	8	11	íme jönnek napok , úgy mond Úr , és eresztek éhséget földre , nem kenyérnek éhségét , sem víznek szomjúságát , de Isten igéje hallgatásának érted éhséget .
